{
  "$schema": "https://json-schema.org/draft/2020-12/schema",
  "title": "rcplug plugin manifest",
  "description": "plugin.json in a plugin directory. See docs/plugin-api.md.",
  "type": "object",
  "required": [
    "exec"
  ],
  "additionalProperties": false,
  "properties": {
    "$schema": {
      "type": "string"
    },
    "name": {
      "type": "string",
      "description": "Informational. The plugin id is always the directory name.",
      "pattern": "^[a-z0-9][a-z0-9_-]*$"
    },
    "title": {
      "type": "string",
      "description": "Name shown in the dashboard (English)."
    },
    "description": {
      "type": "string",
      "description": "One or two sentences for the plugin list (English)."
    },
    "version": {
      "type": "string",
      "description": "Semantic version of the plugin."
    },
    "exec": {
      "type": "array",
      "minItems": 1,
      "items": {
        "type": "string"
      },
      "description": "Command line, run in the plugin directory. Start the plugin's own program with ./ (a bare name is looked up in PATH). {{port}} becomes the assigned loopback port, {{dir}} the plugin directory."
    },
    "httpProxy": {
      "type": "string",
      "description": "Loopback address the host proxies /plugins/<name>/ to, usually 127.0.0.1:{{port}}. Omit for plugins without a web UI.",
      "pattern": "^(http://)?(127\\.0\\.0\\.1|localhost|\\[::1\\]):(\\{\\{port\\}\\}|[0-9]{1,5})$"
    },
    "autostart": {
      "type": "boolean",
      "default": false,
      "description": "Run the plugin by default."
    },
    "needsAudio": {
      "type": "boolean",
      "default": false,
      "description": "Advisory badge in the dashboard (older form of the permission \"audio\")."
    },
    "permissions": {
      "type": "array",
      "description": "What the plugin does beyond its own pages, shown on its card in the dashboard. desk:write: changes the desk through the console (the console refuses writes from plugins without it). audio: hears the desk through the shared audio taps (the host refuses the stream without it). network and device: shown only. See docs/plugin-api.md#permissions.",
      "uniqueItems": true,
      "items": {
        "enum": ["desk:write", "audio", "network", "device", "screen"]
      }
    },
    "primary": {
      "type": "boolean",
      "default": false,
      "description": "Open this plugin as the dashboard's start page."
    },
    "order": {
      "type": "integer",
      "default": 0,
      "description": "Navigation order, lower first."
    },
    "icon": {
      "type": "string",
      "maxLength": 8,
      "description": "Short glyph or emoji for the navigation."
    },
    "update": {
      "type": "object",
      "description": "Where updates of this plugin come from: the latest GitHub release of this repository, with a signed release.json (see docs/updates.md). Updates are only offered and installed from the dashboard.",
      "required": ["github"],
      "additionalProperties": false,
      "properties": {
        "github": {
          "type": "string",
          "description": "owner/name of the GitHub repository.",
          "pattern": "^[A-Za-z0-9][A-Za-z0-9-]*/[A-Za-z0-9._-]+$"
        },
        "publicKey": {
          "type": "string",
          "description": "Ed25519 public key (base64) that signs this plugin's releases, trusted in addition to rcplug's built-in release keys. The key in the installed plugin.json checks the next update.",
          "pattern": "^[A-Za-z0-9+/]{43}=$"
        }
      }
    },
    "translations": {
      "type": "object",
      "description": "Localised title and description keyed by language code.",
      "propertyNames": {
        "pattern": "^[a-z]{2}(-[A-Z]{2})?$"
      },
      "additionalProperties": {
        "type": "object",
        "additionalProperties": false,
        "properties": {
          "title": {
            "type": "string"
          },
          "description": {
            "type": "string"
          },
          "options": {
            "type": "object",
            "description": "Localised option titles, descriptions and choice titles, keyed by option id.",
            "additionalProperties": {
              "type": "object",
              "additionalProperties": false,
              "properties": {
                "title": {
                  "type": "string"
                },
                "description": {
                  "type": "string"
                },
                "choices": {
                  "type": "object",
                  "description": "Choice value → localised title.",
                  "additionalProperties": {
                    "type": "string"
                  }
                }
              }
            }
          }
        }
      }
    },
    "actions": {
      "type": "array",
      "description": "Entry points other UIs show for this plugin, e.g. a button on every channel strip of the console. Needs httpProxy.",
      "items": {
        "type": "object",
        "required": [
          "id",
          "context",
          "title",
          "path"
        ],
        "additionalProperties": false,
        "properties": {
          "id": {
            "type": "string",
            "pattern": "^[a-z0-9][a-z0-9_-]*$"
          },
          "context": {
            "type": "string",
            "description": "Where the action is shown. The console knows \"channel\".",
            "pattern": "^[a-z][a-z0-9-]*$"
          },
          "title": {
            "type": "string"
          },
          "icon": {
            "type": "string",
            "maxLength": 8
          },
          "path": {
            "type": "string",
            "description": "Relative to the plugin's UI. Placeholders for \"channel\": {strip}, {index}, {source}, {label}."
          },
          "translations": {
            "type": "object",
            "additionalProperties": {
              "type": "object",
              "additionalProperties": false,
              "properties": {
                "title": {
                  "type": "string"
                }
              }
            }
          }
        }
      }
    },
    "options": {
      "type": "array",
      "description": "Settings users change in the dashboard (Plugins → Settings), so no one needs a shell. The host passes a value a user has set as a command-line argument (arg) or an environment variable (env); otherwise the plugin's own default applies. Values are kept in config/<name>.json. See docs/plugin-api.md#options.",
      "items": {
        "type": "object",
        "required": [
          "id",
          "type",
          "title"
        ],
        "additionalProperties": false,
        "properties": {
          "id": {
            "type": "string",
            "pattern": "^[a-zA-Z][a-zA-Z0-9_-]{0,63}$"
          },
          "type": {
            "enum": [
              "bool",
              "choice",
              "number",
              "text"
            ]
          },
          "title": {
            "type": "string",
            "minLength": 1
          },
          "description": {
            "type": "string"
          },
          "default": {
            "description": "The plugin's own default, shown in the dashboard; it is not passed."
          },
          "choices": {
            "type": "array",
            "items": {
              "type": "object",
              "required": [
                "value",
                "title"
              ],
              "additionalProperties": false,
              "properties": {
                "value": {
                  "type": "string",
                  "minLength": 1
                },
                "title": {
                  "type": "string",
                  "minLength": 1
                }
              }
            }
          },
          "min": {
            "type": "number"
          },
          "max": {
            "type": "number"
          },
          "maxLength": {
            "type": "integer",
            "minimum": 0,
            "maximum": 4096,
            "description": "Text: maximum length (default 256)."
          },
          "pattern": {
            "type": "string",
            "description": "Text: a regular expression the whole value must match."
          },
          "arg": {
            "type": "string",
            "description": "bool: the flag added when true (--read-only); otherwise one argument with {value} (--level={value})."
          },
          "env": {
            "type": "string",
            "pattern": "^[A-Z_][A-Z0-9_]*$",
            "description": "An environment variable set to the value (bool: 1 or 0); not RCPLUG_*."
          }
        }
      }
    }
  }
}
