{
  "$schema": "../../plugin.schema.json",
  "name": "console",
  "title": "Console",
  "description": "The whole mixer in the browser: channels, levels, routing, inputs, effects, pads, recorder and system – mirrored live and optionally remote-controllable.",
  "version": "0.8.17",
  "exec": ["./console", "--addr", "127.0.0.1:{{port}}"],
  "httpProxy": "127.0.0.1:{{port}}",
  "autostart": true,
  "primary": true,
  "order": 10,
  "icon": "🎛",
  "translations": {
    "de": {
      "title": "Konsole",
      "description": "Das komplette Mischpult im Browser: Kanäle, Pegel, Routing, Eingänge, Effekte, Pads, Aufnahme und System – live gespiegelt und optional fernsteuerbar.",
      "options": {
        "meters": {
          "title": "Pegelmesser",
          "description": "Pegel und Stellungen der Hardware-Fader aus dem Shared Memory des Mixers lesen (nur lesend).",
          "choices": {
            "auto": "Vom Mixer",
            "off": "Aus"
          }
        },
        "deskMode": {
          "title": "Verbindung zum Mixer",
          "description": "Automatisch: Auf einem RØDECaster übernimmt die Konsole die Verbindung zum Mixer und reicht alles an den Gerätebildschirm weiter (volle Steuerung), so lässt sich jede Einstellung im Browser ändern; geht das nicht, liest sie mit. Nur mitlesen: Die Konsole ändert nur, was am Gerät eine Taste hat (der Weg zurück, falls die volle Steuerung nach einem Firmware-Update Probleme macht). Verbinden: nur zur Fehlersuche.",
          "choices": {
            "auto": "Automatisch (volle Steuerung)",
            "tap": "Nur mitlesen",
            "connect": "Verbinden (Fehlersuche)"
          }
        },
        "allowUntested": {
          "title": "Steuern auf ungetesteten Modellen",
          "description": "Steuerung auf Modellen ohne geprüftes Profil anbieten, etwa dem RØDECaster Pro II. Auf eigene Gefahr."
        }
      }
    }
  },
  "options": [
    {
      "id": "meters",
      "type": "choice",
      "title": "Level meters",
      "description": "Read the meters and the hardware faders' positions from the mixer's shared memory (read-only).",
      "default": "auto",
      "choices": [
        {
          "value": "auto",
          "title": "From the mixer"
        },
        {
          "value": "off",
          "title": "Off"
        }
      ],
      "arg": "--meters={value}"
    },
    {
      "id": "deskMode",
      "type": "choice",
      "title": "Connection to the mixer",
      "description": "Automatic: on a RØDECaster the console takes the mixer's connection and passes everything on to the device's screen (full control), so every setting can be changed in the browser; if that is not possible it reads along. Read along only: the console changes only what has a button on the device (the way back if full control misbehaves after a firmware update). Connect: only for troubleshooting.",
      "default": "auto",
      "choices": [
        {
          "value": "auto",
          "title": "Automatic (full control)"
        },
        {
          "value": "tap",
          "title": "Read along only"
        },
        {
          "value": "connect",
          "title": "Connect (troubleshooting)"
        }
      ],
      "arg": "--desk-mode={value}"
    },
    {
      "id": "allowUntested",
      "type": "bool",
      "title": "Control on untested models",
      "description": "Offer control on models without a verified profile, such as the RØDECaster Pro II. At your own risk.",
      "default": false,
      "arg": "--allow-untested-model"
    }
  ]
}
